Observation-CTAnteriorSurfaceRightEyeExample.json

{
  "resourceType" : "Observation",
  "id" : "CTAnteriorSurfaceRightEyeExample",
  "meta" : {
    "profile" : ["https://YasniiSS.github.io/fhir4eyes/StructureDefinition/ct-anterior-surface"]
  },
  "text" : {
    "status" : "generated",
    "div" : "<div xmlns=\"http://www.w3.org/1999/xhtml\"><p class=\"res-header-id\"><b>Generated Narrative: Observation CTAnteriorSurfaceRightEyeExample</b></p><a name=\"CTAnteriorSurfaceRightEyeExample\"> </a><a name=\"hcCTAnteriorSurfaceRightEyeExample\"> </a><div style=\"display: inline-block; background-color: #d9e0e7; padding: 6px; margin: 4px; border: 1px solid #8da1b4; border-radius: 5px; line-height: 60%\"><p style=\"margin-bottom: 0px\"/><p style=\"margin-bottom: 0px\">Profile: <a href=\"StructureDefinition-ct-anterior-surface.html\">Corneal Tomography - Anterior Surface</a></p></div><p><b>status</b>: Final</p><p><b>category</b>: <span title=\"Codes:{http://terminology.hl7.org/CodeSystem/observation-category exam}\">Exam</span></p><p><b>code</b>: <span title=\"Codes:\">Corneal tomography, anterior surface analysis</span></p><p><b>subject</b>: <a href=\"Patient-PatientExample.html\">Patient Example  Female, DoB: 1990-01-01 ( PA1234567)</a></p><p><b>note</b>: </p><blockquote><div><p>Example based on typical Pentacam-style anterior surface report</p>\n</div></blockquote><p><b>bodySite</b>: <span title=\"Codes:\"></span></p><p><b>device</b>: Pentacam AXL</p><blockquote><p><b>component</b></p><p><b>code</b>: <span title=\"Codes:\">K1 (flat axis)</span></p><p><b>value</b>: 43.2 [diop]<span style=\"background: LightGoldenRodYellow\"> (Details: UCUM  code[diop] = '[diop]')</span></p></blockquote><blockquote><p><b>component</b></p><p><b>code</b>: <span title=\"Codes:\">K1 axis</span></p><p><b>value</b>: 12 deg<span style=\"background: LightGoldenRodYellow\"> (Details: UCUM  codedeg = 'deg')</span></p></blockquote><blockquote><p><b>component</b></p><p><b>code</b>: <span title=\"Codes:\">K1 radius</span></p><p><b>value</b>: 7.81 mm<span style=\"background: LightGoldenRodYellow\"> (Details: UCUM  codemm = 'mm')</span></p></blockquote><blockquote><p><b>component</b></p><p><b>code</b>: <span title=\"Codes:\">K2 (steep axis)</span></p><p><b>value</b>: 44.6 [diop]<span style=\"background: LightGoldenRodYellow\"> (Details: UCUM  code[diop] = '[diop]')</span></p></blockquote><blockquote><p><b>component</b></p><p><b>code</b>: <span title=\"Codes:\">K2 axis</span></p><p><b>value</b>: 102 deg<span style=\"background: LightGoldenRodYellow\"> (Details: UCUM  codedeg = 'deg')</span></p></blockquote><blockquote><p><b>component</b></p><p><b>code</b>: <span title=\"Codes:\">K2 radius</span></p><p><b>value</b>: 7.56 mm<span style=\"background: LightGoldenRodYellow\"> (Details: UCUM  codemm = 'mm')</span></p></blockquote><blockquote><p><b>component</b></p><p><b>code</b>: <span title=\"Codes:\">Km (average)</span></p><p><b>value</b>: 43.9 [diop]<span style=\"background: LightGoldenRodYellow\"> (Details: UCUM  code[diop] = '[diop]')</span></p></blockquote><blockquote><p><b>component</b></p><p><b>code</b>: <span title=\"Codes:\">Corneal astigmatism</span></p><p><b>value</b>: 1.4 [diop]<span style=\"background: LightGoldenRodYellow\"> (Details: UCUM  code[diop] = '[diop]')</span></p></blockquote><blockquote><p><b>component</b></p><p><b>code</b>: <span title=\"Codes:\">Corneal cylinder</span></p><p><b>value</b>: -1.4 [diop]<span style=\"background: LightGoldenRodYellow\"> (Details: UCUM  code[diop] = '[diop]')</span></p></blockquote><blockquote><p><b>component</b></p><p><b>code</b>: <span title=\"Codes:\">K Max (front)</span></p><p><b>value</b>: 45.8 [diop]<span style=\"background: LightGoldenRodYellow\"> (Details: UCUM  code[diop] = '[diop]')</span></p></blockquote><blockquote><p><b>component</b></p><p><b>code</b>: <span title=\"Codes:\">SimK steep/flat</span></p><p><b>value</b>: 44.1 [diop]<span style=\"background: LightGoldenRodYellow\"> (Details: UCUM  code[diop] = '[diop]')</span></p></blockquote><blockquote><p><b>component</b></p><p><b>code</b>: <span title=\"Codes:\">Rh (horizontal radius)</span></p><p><b>value</b>: 7.81 mm<span style=\"background: LightGoldenRodYellow\"> (Details: UCUM  codemm = 'mm')</span></p></blockquote><blockquote><p><b>component</b></p><p><b>code</b>: <span title=\"Codes:\">Rv (vertical radius)</span></p><p><b>value</b>: 7.56 mm<span style=\"background: LightGoldenRodYellow\"> (Details: UCUM  codemm = 'mm')</span></p></blockquote><blockquote><p><b>component</b></p><p><b>code</b>: <span title=\"Codes:\">Rmin (minimum radius)</span></p><p><b>value</b>: 7.4 mm<span style=\"background: LightGoldenRodYellow\"> (Details: UCUM  codemm = 'mm')</span></p></blockquote><blockquote><p><b>component</b></p><p><b>code</b>: <span title=\"Codes:\">Q-value front</span></p><p><b>value</b>: -0.24 1<span style=\"background: LightGoldenRodYellow\"> (Details: UCUM  code1 = '1')</span></p></blockquote><blockquote><p><b>component</b></p><p><b>code</b>: <span title=\"Codes:\">Elevation front BFS</span></p><p><b>value</b>: 4 um<span style=\"background: LightGoldenRodYellow\"> (Details: UCUM  codeum = 'um')</span></p></blockquote><blockquote><p><b>component</b></p><p><b>code</b>: <span title=\"Codes:\">BFS radius front</span></p><p><b>value</b>: 7.78 mm<span style=\"background: LightGoldenRodYellow\"> (Details: UCUM  codemm = 'mm')</span></p></blockquote><blockquote><p><b>component</b></p><p><b>code</b>: <span title=\"Codes:\">Surface Regularity Index (SRI)</span></p><p><b>value</b>: 0.42 1<span style=\"background: LightGoldenRodYellow\"> (Details: UCUM  code1 = '1')</span></p></blockquote><blockquote><p><b>component</b></p><p><b>code</b>: <span title=\"Codes:\">Surface Asymmetry Index (SAI)</span></p><p><b>value</b>: 0.38 1<span style=\"background: LightGoldenRodYellow\"> (Details: UCUM  code1 = '1')</span></p></blockquote><blockquote><p><b>component</b></p><p><b>code</b>: <span title=\"Codes:\">I-S value</span></p><p><b>value</b>: 0.6 [diop]<span style=\"background: LightGoldenRodYellow\"> (Details: UCUM  code[diop] = '[diop]')</span></p></blockquote><blockquote><p><b>component</b></p><p><b>code</b>: <span title=\"Codes:\">KISA% index</span></p><p><b>value</b>: 12.4 %<span style=\"background: LightGoldenRodYellow\"> (Details: UCUM  code% = '%')</span></p></blockquote><blockquote><p><b>component</b></p><p><b>code</b>: <span title=\"Codes:\">Keratometric index</span></p><p><b>value</b>: 1.3375 1<span style=\"background: LightGoldenRodYellow\"> (Details: UCUM  code1 = '1')</span></p></blockquote><blockquote><p><b>component</b></p><p><b>code</b>: <span title=\"Codes:\">Topographic pattern</span></p><p><b>value</b>: <span title=\"Codes:\">Regular</span></p></blockquote><blockquote><p><b>component</b></p><p><b>code</b>: <span title=\"Codes:\">Total Corneal Refractive Power (TCRP)</span></p><p><b>value</b>: 43.5 [diop]<span style=\"background: LightGoldenRodYellow\"> (Details: UCUM  code[diop] = '[diop]')</span></p></blockquote><blockquote><p><b>component</b></p><p><b>code</b>: <span title=\"Codes:\">True Net Power (TNP)</span></p><p><b>value</b>: 43.3 [diop]<span style=\"background: LightGoldenRodYellow\"> (Details: UCUM  code[diop] = '[diop]')</span></p></blockquote><blockquote><p><b>component</b></p><p><b>code</b>: <span title=\"Codes:\">EKR 1.0mm zone</span></p><p><b>value</b>: 43.7 [diop]<span style=\"background: LightGoldenRodYellow\"> (Details: UCUM  code[diop] = '[diop]')</span></p></blockquote><blockquote><p><b>component</b></p><p><b>code</b>: <span title=\"Codes:\">EKR 3.0mm zone</span></p><p><b>value</b>: 43.4 [diop]<span style=\"background: LightGoldenRodYellow\"> (Details: UCUM  code[diop] = '[diop]')</span></p></blockquote><blockquote><p><b>component</b></p><p><b>code</b>: <span title=\"Codes:\">EKR 4.5mm zone</span></p><p><b>value</b>: 43.1 [diop]<span style=\"background: LightGoldenRodYellow\"> (Details: UCUM  code[diop] = '[diop]')</span></p></blockquote><blockquote><p><b>component</b></p><p><b>code</b>: <span title=\"Codes:\">3mm zone Mean Power</span></p><p><b>value</b>: 43.8 [diop]<span style=\"background: LightGoldenRodYellow\"> (Details: UCUM  code[diop] = '[diop]')</span></p></blockquote><blockquote><p><b>component</b></p><p><b>code</b>: <span title=\"Codes:\">3mm zone Astig Power</span></p><p><b>value</b>: 1.3 [diop]<span style=\"background: LightGoldenRodYellow\"> (Details: UCUM  code[diop] = '[diop]')</span></p></blockquote><blockquote><p><b>component</b></p><p><b>code</b>: <span title=\"Codes:\">3mm zone Steep Axis</span></p><p><b>value</b>: 100 deg<span style=\"background: LightGoldenRodYellow\"> (Details: UCUM  codedeg = 'deg')</span></p></blockquote><blockquote><p><b>component</b></p><p><b>code</b>: <span title=\"Codes:\">3mm zone Flat Axis</span></p><p><b>value</b>: 10 deg<span style=\"background: LightGoldenRodYellow\"> (Details: UCUM  codedeg = 'deg')</span></p></blockquote><blockquote><p><b>component</b></p><p><b>code</b>: <span title=\"Codes:\">5mm zone Mean Power</span></p><p><b>value</b>: 43.6 [diop]<span style=\"background: LightGoldenRodYellow\"> (Details: UCUM  code[diop] = '[diop]')</span></p></blockquote><blockquote><p><b>component</b></p><p><b>code</b>: <span title=\"Codes:\">5mm zone Astig Power</span></p><p><b>value</b>: 1.5 [diop]<span style=\"background: LightGoldenRodYellow\"> (Details: UCUM  code[diop] = '[diop]')</span></p></blockquote><blockquote><p><b>component</b></p><p><b>code</b>: <span title=\"Codes:\">5mm zone Steep Axis</span></p><p><b>value</b>: 103 deg<span style=\"background: LightGoldenRodYellow\"> (Details: UCUM  codedeg = 'deg')</span></p></blockquote><blockquote><p><b>component</b></p><p><b>code</b>: <span title=\"Codes:\">5mm zone Flat Axis</span></p><p><b>value</b>: 13 deg<span style=\"background: LightGoldenRodYellow\"> (Details: UCUM  codedeg = 'deg')</span></p></blockquote><blockquote><p><b>component</b></p><p><b>code</b>: <span title=\"Codes:\">Total corneal astigmatism (tWFA)</span></p><p><b>value</b>: 1.3 [diop]<span style=\"background: LightGoldenRodYellow\"> (Details: UCUM  code[diop] = '[diop]')</span></p></blockquote><blockquote><p><b>component</b></p><p><b>code</b>: <span title=\"Codes:\">Total corneal irregular astigmatism</span></p><p><b>value</b>: 0.2 [diop]<span style=\"background: LightGoldenRodYellow\"> (Details: UCUM  code[diop] = '[diop]')</span></p></blockquote><blockquote><p><b>component</b></p><p><b>code</b>: <span title=\"Codes:\">Corneal HOA RMS</span></p><p><b>value</b>: 0.31 um<span style=\"background: LightGoldenRodYellow\"> (Details: UCUM  codeum = 'um')</span></p></blockquote><blockquote><p><b>component</b></p><p><b>code</b>: <span title=\"Codes:\">Kappa angle</span></p><p><b>value</b>: 4.2 deg<span style=\"background: LightGoldenRodYellow\"> (Details: UCUM  codedeg = 'deg')</span></p></blockquote><blockquote><p><b>component</b></p><p><b>code</b>: <span title=\"Codes:\">Kappa intercept</span></p><p><b>value</b>: x: 0.18mm, y: -0.06mm</p></blockquote><blockquote><p><b>component</b></p><p><b>code</b>: <span title=\"Codes:\">SIA (Surgically Induced Astigmatism)</span></p><p><b>value</b>: 0.3 [diop]<span style=\"background: LightGoldenRodYellow\"> (Details: UCUM  code[diop] = '[diop]')</span></p></blockquote><blockquote><p><b>component</b></p><p><b>code</b>: <span title=\"Codes:\">Predicted post-op corneal astigmatism</span></p><p><b>value</b>: 0.4 [diop]<span style=\"background: LightGoldenRodYellow\"> (Details: UCUM  code[diop] = '[diop]')</span></p></blockquote><blockquote><p><b>component</b></p><p><b>code</b>: <span title=\"Codes:\">Optimal toric IOL axis</span></p><p><b>value</b>: 102 deg<span style=\"background: LightGoldenRodYellow\"> (Details: UCUM  codedeg = 'deg')</span></p></blockquote><blockquote><p><b>component</b></p><p><b>code</b>: <span title=\"Codes:\">QS (quality score)</span></p><p><b>value</b>: <span title=\"Codes:\">OK</span></p></blockquote></div>"
  },
  "status" : "final",
  "category" : [{
    "coding" : [{
      "system" : "http://terminology.hl7.org/CodeSystem/observation-category",
      "code" : "exam",
      "display" : "Exam"
    }]
  }],
  "code" : {
    "text" : "Corneal tomography, anterior surface analysis"
  },
  "subject" : {
    "reference" : "Patient/PatientExample"
  },
  "note" : [{
    "text" : "Example based on typical Pentacam-style anterior surface report"
  }],
  "bodySite" : {
    "extension" : [{
      "url" : "http://hl7.org/fhir/StructureDefinition/bodySite",
      "valueReference" : {
        "reference" : "BodyStructure/RightEyeStructureExample"
      }
    }]
  },
  "device" : {
    "display" : "Pentacam AXL"
  },
  "component" : [{
    "code" : {
      "text" : "K1 (flat axis)"
    },
    "valueQuantity" : {
      "value" : 43.2,
      "system" : "http://unitsofmeasure.org",
      "code" : "[diop]"
    }
  },
  {
    "code" : {
      "text" : "K1 axis"
    },
    "valueQuantity" : {
      "value" : 12,
      "system" : "http://unitsofmeasure.org",
      "code" : "deg"
    }
  },
  {
    "code" : {
      "text" : "K1 radius"
    },
    "valueQuantity" : {
      "value" : 7.81,
      "system" : "http://unitsofmeasure.org",
      "code" : "mm"
    }
  },
  {
    "code" : {
      "text" : "K2 (steep axis)"
    },
    "valueQuantity" : {
      "value" : 44.6,
      "system" : "http://unitsofmeasure.org",
      "code" : "[diop]"
    }
  },
  {
    "code" : {
      "text" : "K2 axis"
    },
    "valueQuantity" : {
      "value" : 102,
      "system" : "http://unitsofmeasure.org",
      "code" : "deg"
    }
  },
  {
    "code" : {
      "text" : "K2 radius"
    },
    "valueQuantity" : {
      "value" : 7.56,
      "system" : "http://unitsofmeasure.org",
      "code" : "mm"
    }
  },
  {
    "code" : {
      "text" : "Km (average)"
    },
    "valueQuantity" : {
      "value" : 43.9,
      "system" : "http://unitsofmeasure.org",
      "code" : "[diop]"
    }
  },
  {
    "code" : {
      "text" : "Corneal astigmatism"
    },
    "valueQuantity" : {
      "value" : 1.4,
      "system" : "http://unitsofmeasure.org",
      "code" : "[diop]"
    }
  },
  {
    "code" : {
      "text" : "Corneal cylinder"
    },
    "valueQuantity" : {
      "value" : -1.4,
      "system" : "http://unitsofmeasure.org",
      "code" : "[diop]"
    }
  },
  {
    "code" : {
      "text" : "K Max (front)"
    },
    "valueQuantity" : {
      "value" : 45.8,
      "system" : "http://unitsofmeasure.org",
      "code" : "[diop]"
    }
  },
  {
    "code" : {
      "text" : "SimK steep/flat"
    },
    "valueQuantity" : {
      "value" : 44.1,
      "system" : "http://unitsofmeasure.org",
      "code" : "[diop]"
    }
  },
  {
    "code" : {
      "text" : "Rh (horizontal radius)"
    },
    "valueQuantity" : {
      "value" : 7.81,
      "system" : "http://unitsofmeasure.org",
      "code" : "mm"
    }
  },
  {
    "code" : {
      "text" : "Rv (vertical radius)"
    },
    "valueQuantity" : {
      "value" : 7.56,
      "system" : "http://unitsofmeasure.org",
      "code" : "mm"
    }
  },
  {
    "code" : {
      "text" : "Rmin (minimum radius)"
    },
    "valueQuantity" : {
      "value" : 7.4,
      "system" : "http://unitsofmeasure.org",
      "code" : "mm"
    }
  },
  {
    "code" : {
      "text" : "Q-value front"
    },
    "valueQuantity" : {
      "value" : -0.24,
      "system" : "http://unitsofmeasure.org",
      "code" : "1"
    }
  },
  {
    "code" : {
      "text" : "Elevation front BFS"
    },
    "valueQuantity" : {
      "value" : 4,
      "system" : "http://unitsofmeasure.org",
      "code" : "um"
    }
  },
  {
    "code" : {
      "text" : "BFS radius front"
    },
    "valueQuantity" : {
      "value" : 7.78,
      "system" : "http://unitsofmeasure.org",
      "code" : "mm"
    }
  },
  {
    "code" : {
      "text" : "Surface Regularity Index (SRI)"
    },
    "valueQuantity" : {
      "value" : 0.42,
      "system" : "http://unitsofmeasure.org",
      "code" : "1"
    }
  },
  {
    "code" : {
      "text" : "Surface Asymmetry Index (SAI)"
    },
    "valueQuantity" : {
      "value" : 0.38,
      "system" : "http://unitsofmeasure.org",
      "code" : "1"
    }
  },
  {
    "code" : {
      "text" : "I-S value"
    },
    "valueQuantity" : {
      "value" : 0.6,
      "system" : "http://unitsofmeasure.org",
      "code" : "[diop]"
    }
  },
  {
    "code" : {
      "text" : "KISA% index"
    },
    "valueQuantity" : {
      "value" : 12.4,
      "system" : "http://unitsofmeasure.org",
      "code" : "%"
    }
  },
  {
    "code" : {
      "text" : "Keratometric index"
    },
    "valueQuantity" : {
      "value" : 1.3375,
      "system" : "http://unitsofmeasure.org",
      "code" : "1"
    }
  },
  {
    "code" : {
      "text" : "Topographic pattern"
    },
    "valueCodeableConcept" : {
      "text" : "Regular"
    }
  },
  {
    "code" : {
      "text" : "Total Corneal Refractive Power (TCRP)"
    },
    "valueQuantity" : {
      "value" : 43.5,
      "system" : "http://unitsofmeasure.org",
      "code" : "[diop]"
    }
  },
  {
    "code" : {
      "text" : "True Net Power (TNP)"
    },
    "valueQuantity" : {
      "value" : 43.3,
      "system" : "http://unitsofmeasure.org",
      "code" : "[diop]"
    }
  },
  {
    "code" : {
      "text" : "EKR 1.0mm zone"
    },
    "valueQuantity" : {
      "value" : 43.7,
      "system" : "http://unitsofmeasure.org",
      "code" : "[diop]"
    }
  },
  {
    "code" : {
      "text" : "EKR 3.0mm zone"
    },
    "valueQuantity" : {
      "value" : 43.4,
      "system" : "http://unitsofmeasure.org",
      "code" : "[diop]"
    }
  },
  {
    "code" : {
      "text" : "EKR 4.5mm zone"
    },
    "valueQuantity" : {
      "value" : 43.1,
      "system" : "http://unitsofmeasure.org",
      "code" : "[diop]"
    }
  },
  {
    "code" : {
      "text" : "3mm zone Mean Power"
    },
    "valueQuantity" : {
      "value" : 43.8,
      "system" : "http://unitsofmeasure.org",
      "code" : "[diop]"
    }
  },
  {
    "code" : {
      "text" : "3mm zone Astig Power"
    },
    "valueQuantity" : {
      "value" : 1.3,
      "system" : "http://unitsofmeasure.org",
      "code" : "[diop]"
    }
  },
  {
    "code" : {
      "text" : "3mm zone Steep Axis"
    },
    "valueQuantity" : {
      "value" : 100,
      "system" : "http://unitsofmeasure.org",
      "code" : "deg"
    }
  },
  {
    "code" : {
      "text" : "3mm zone Flat Axis"
    },
    "valueQuantity" : {
      "value" : 10,
      "system" : "http://unitsofmeasure.org",
      "code" : "deg"
    }
  },
  {
    "code" : {
      "text" : "5mm zone Mean Power"
    },
    "valueQuantity" : {
      "value" : 43.6,
      "system" : "http://unitsofmeasure.org",
      "code" : "[diop]"
    }
  },
  {
    "code" : {
      "text" : "5mm zone Astig Power"
    },
    "valueQuantity" : {
      "value" : 1.5,
      "system" : "http://unitsofmeasure.org",
      "code" : "[diop]"
    }
  },
  {
    "code" : {
      "text" : "5mm zone Steep Axis"
    },
    "valueQuantity" : {
      "value" : 103,
      "system" : "http://unitsofmeasure.org",
      "code" : "deg"
    }
  },
  {
    "code" : {
      "text" : "5mm zone Flat Axis"
    },
    "valueQuantity" : {
      "value" : 13,
      "system" : "http://unitsofmeasure.org",
      "code" : "deg"
    }
  },
  {
    "code" : {
      "text" : "Total corneal astigmatism (tWFA)"
    },
    "valueQuantity" : {
      "value" : 1.3,
      "system" : "http://unitsofmeasure.org",
      "code" : "[diop]"
    }
  },
  {
    "code" : {
      "text" : "Total corneal irregular astigmatism"
    },
    "valueQuantity" : {
      "value" : 0.2,
      "system" : "http://unitsofmeasure.org",
      "code" : "[diop]"
    }
  },
  {
    "code" : {
      "text" : "Corneal HOA RMS"
    },
    "valueQuantity" : {
      "value" : 0.31,
      "system" : "http://unitsofmeasure.org",
      "code" : "um"
    }
  },
  {
    "code" : {
      "text" : "Kappa angle"
    },
    "valueQuantity" : {
      "value" : 4.2,
      "system" : "http://unitsofmeasure.org",
      "code" : "deg"
    }
  },
  {
    "code" : {
      "text" : "Kappa intercept"
    },
    "valueString" : "x: 0.18mm, y: -0.06mm"
  },
  {
    "code" : {
      "text" : "SIA (Surgically Induced Astigmatism)"
    },
    "valueQuantity" : {
      "value" : 0.3,
      "system" : "http://unitsofmeasure.org",
      "code" : "[diop]"
    }
  },
  {
    "code" : {
      "text" : "Predicted post-op corneal astigmatism"
    },
    "valueQuantity" : {
      "value" : 0.4,
      "system" : "http://unitsofmeasure.org",
      "code" : "[diop]"
    }
  },
  {
    "code" : {
      "text" : "Optimal toric IOL axis"
    },
    "valueQuantity" : {
      "value" : 102,
      "system" : "http://unitsofmeasure.org",
      "code" : "deg"
    }
  },
  {
    "code" : {
      "text" : "QS (quality score)"
    },
    "valueCodeableConcept" : {
      "text" : "OK"
    }
  }]
}

Observation-CTAnteriorSurfaceRightEyeExample.md

## Example Observation: CT anterior surface: right eye

> **component****code**: K1 (flat axis)**value**: 43.2 [diop] (Details: UCUM code[diop] = '[diop]')

> **component****code**: K1 radius**value**: 7.81 mm (Details: UCUM codemm = 'mm')

> **component****code**: K2 (steep axis)**value**: 44.6 [diop] (Details: UCUM code[diop] = '[diop]')

> **component****code**: K2 radius**value**: 7.56 mm (Details: UCUM codemm = 'mm')

> **component****code**: Km (average)**value**: 43.9 [diop] (Details: UCUM code[diop] = '[diop]')

> **component****code**: K Max (front)**value**: 45.8 [diop] (Details: UCUM code[diop] = '[diop]')

> **component****code**: SimK steep/flat**value**: 44.1 [diop] (Details: UCUM code[diop] = '[diop]')

> **component****code**: BFS radius front**value**: 7.78 mm (Details: UCUM codemm = 'mm')

> **component****code**: KISA% index**value**: 12.4 % (Details: UCUM code% = '%')

> **component****code**: Keratometric index**value**: 1.3375 1 (Details: UCUM code1 = '1')

> **component****code**: Total Corneal Refractive Power (TCRP)**value**: 43.5 [diop] (Details: UCUM code[diop] = '[diop]')

> **component****code**: True Net Power (TNP)**value**: 43.3 [diop] (Details: UCUM code[diop] = '[diop]')

> **component****code**: EKR 1.0mm zone**value**: 43.7 [diop] (Details: UCUM code[diop] = '[diop]')

> **component****code**: EKR 3.0mm zone**value**: 43.4 [diop] (Details: UCUM code[diop] = '[diop]')

> **component****code**: EKR 4.5mm zone**value**: 43.1 [diop] (Details: UCUM code[diop] = '[diop]')

> **component****code**: 3mm zone Mean Power**value**: 43.8 [diop] (Details: UCUM code[diop] = '[diop]')

> **component****code**: 5mm zone Mean Power**value**: 43.6 [diop] (Details: UCUM code[diop] = '[diop]')